{
  "artifact_links": {
    "dated_consumer_markdown": "reports/2026-07-05.consumer.md",
    "dated_event_stream": "reports/2026-07-05.events.ndjson",
    "dated_markdown": "reports/2026-07-05.md",
    "dated_report_json": "reports/2026-07-05.json",
    "dated_summary_json": "reports/2026-07-05.summary.json",
    "latest_consumer_markdown": "reports/latest.consumer.md",
    "latest_event_stream": "reports/latest.events.ndjson",
    "latest_markdown": "reports/latest.md",
    "latest_report_json": "reports/latest.json",
    "latest_summary_json": "reports/latest.summary.json",
    "report_index": "reports/index.md"
  },
  "artifact_type": "tracker-summary",
  "artifact_version": "1.0.0",
  "event_stream": {
    "commit_event_count": 38,
    "dated_path": "reports/2026-07-05.events.ndjson",
    "event_count": 39,
    "latest_path": "reports/latest.events.ndjson",
    "release_event_count": 1,
    "schema_url": "schemas/event.v1.schema.json"
  },
  "filters": {
    "categories": [
      "docs",
      "reference",
      "samples",
      "training"
    ],
    "events_prefilter_mode": "off",
    "include_archived": false,
    "include_forks": false,
    "include_other": false
  },
  "freshness": {
    "age_hours": 0.0,
    "latest_report_stale": false,
    "max_age_hours": 30,
    "state": "fresh"
  },
  "generated_at": "2026-07-05T14:54:58.591531Z",
  "noise_summary": {
    "actor_types": {
      "automation": 4,
      "bot": 4,
      "human": 2
    },
    "change_types": {
      "dependency_update": 1,
      "docs_update": 7,
      "sdk_generation": 2
    },
    "event_count": 10,
    "top_repos": [
      {
        "event_count": 4,
        "repo": "MicrosoftDocs/dataexplorer-docs"
      },
      {
        "event_count": 2,
        "repo": "Azure/azure-sdk-for-net"
      },
      {
        "event_count": 1,
        "repo": "MicrosoftDocs/powerbi-docs"
      },
      {
        "event_count": 1,
        "repo": "MicrosoftDocs/azure-aks-docs"
      },
      {
        "event_count": 1,
        "repo": "microsoft/kiota"
      }
    ]
  },
  "plain_english_summary": [
    "Azure, Microsoft Graph led the visible product-area activity in this window.",
    "1 release item(s) were detected during the window.",
    "Start with human-authored changes in Azure/azure-sdk-for-net, MicrosoftDocs/Xandr-docs, MicrosoftDocs/azure-aks-docs, MicrosoftDocs/dataexplorer-docs.",
    "10 event(s) look automated, bot-heavy, dependency, or generated; review the curated sections before raw volume."
  ],
  "product_area_summary": [
    {
      "event_count": 18,
      "noisy_event_count": 7,
      "notable_event_count": 17,
      "product_area": "Azure",
      "release_count": 0,
      "repo_count": 6,
      "security_event_count": 0,
      "top_events": [
        {
          "change_type": "feature",
          "committed_at": "2026-07-04T17:06:23Z",
          "headline": "Add Azure.AI.AgentServer.Optimization client library",
          "notability_score": 90,
          "repo": "Azure/azure-sdk-for-net",
          "url": "https://github.com/Azure/azure-sdk-for-net/pull/59730"
        },
        {
          "change_type": "docs_update",
          "committed_at": "2026-07-05T12:39:10Z",
          "headline": "Publish management review checks for fork PRs",
          "notability_score": 90,
          "repo": "Azure/azure-sdk-for-net",
          "url": "https://github.com/Azure/azure-sdk-for-net/pull/60651"
        },
        {
          "change_type": "docs_update",
          "committed_at": "2026-07-05T11:02:56Z",
          "headline": "Merging changes synced from https://github.com/MicrosoftDocs/azure-ak\u2026",
          "notability_score": 90,
          "repo": "MicrosoftDocs/azure-aks-docs",
          "url": "https://github.com/MicrosoftDocs/azure-aks-docs/commit/70b8858c8149451fbede8b75176b12cb92842d30"
        }
      ],
      "top_repos": [
        {
          "event_count": 5,
          "repo": "MicrosoftDocs/dataexplorer-docs"
        },
        {
          "event_count": 5,
          "repo": "Azure-Samples/cosmos-db-design-patterns"
        },
        {
          "event_count": 4,
          "repo": "Azure/azure-sdk-for-net"
        },
        {
          "event_count": 2,
          "repo": "MicrosoftDocs/azure-aks-docs"
        },
        {
          "event_count": 1,
          "repo": "Azure-Samples/foundry-local-model-catalog"
        }
      ]
    },
    {
      "event_count": 19,
      "noisy_event_count": 2,
      "notable_event_count": 10,
      "product_area": "Unmapped Activity",
      "release_count": 1,
      "repo_count": 6,
      "security_event_count": 0,
      "top_events": [
        {
          "change_type": "release",
          "committed_at": "2026-07-05T04:29:24Z",
          "headline": "v1.12.9",
          "notability_score": 90,
          "repo": "microsoft/dbt-fabricspark",
          "url": "https://github.com/microsoft/dbt-fabricspark/releases/tag/v1.12.9"
        },
        {
          "change_type": "docs_update",
          "committed_at": "2026-07-05T12:36:01Z",
          "headline": "PR-bidders (#1480)",
          "notability_score": 90,
          "repo": "MicrosoftDocs/Xandr-docs",
          "url": "https://github.com/MicrosoftDocs/Xandr-docs/commit/853015be05b18dc8f2ca75c374788bef1a096f49"
        },
        {
          "change_type": "docs_update",
          "committed_at": "2026-07-05T12:19:15Z",
          "headline": "PR-09 (#1478)",
          "notability_score": 90,
          "repo": "MicrosoftDocs/Xandr-docs",
          "url": "https://github.com/MicrosoftDocs/Xandr-docs/commit/5cc621cf87c6a1032462a9ae2dac94b0f4bf2267"
        }
      ],
      "top_repos": [
        {
          "event_count": 5,
          "repo": "microsoft/sample-webapp"
        },
        {
          "event_count": 5,
          "repo": "MicrosoftLearning/mslearn-ai-concepts"
        },
        {
          "event_count": 3,
          "repo": "microsoft/amplifier-app-cli"
        },
        {
          "event_count": 3,
          "repo": "MicrosoftDocs/Xandr-docs"
        },
        {
          "event_count": 2,
          "repo": "microsoft/dbt-fabricspark"
        }
      ]
    },
    {
      "event_count": 1,
      "noisy_event_count": 1,
      "notable_event_count": 1,
      "product_area": "Microsoft Graph",
      "release_count": 0,
      "repo_count": 1,
      "security_event_count": 0,
      "top_events": [
        {
          "change_type": "sdk_generation",
          "committed_at": "2026-07-05T10:12:55Z",
          "headline": "- bumps version for prerelease of 1.32.6",
          "notability_score": 75,
          "repo": "microsoft/kiota",
          "url": "https://github.com/microsoft/kiota/pull/7894"
        }
      ],
      "top_repos": [
        {
          "event_count": 1,
          "repo": "microsoft/kiota"
        }
      ]
    },
    {
      "event_count": 1,
      "noisy_event_count": 0,
      "notable_event_count": 0,
      "product_area": ".NET",
      "release_count": 0,
      "repo_count": 1,
      "security_event_count": 0,
      "top_events": [],
      "top_repos": [
        {
          "event_count": 1,
          "repo": "dotnet/runtime"
        }
      ]
    }
  ],
  "schema_url": "schemas/summary.v1.schema.json",
  "schema_version": 1,
  "source": {
    "commit": "5e832790ed1dc30846c8be2a5bf2041905d4f225",
    "repository": "AZMadeEZ/MS-Repo-Tracker",
    "workflow": "Microsoft Repo Change Digest",
    "workflow_run_id": "28744716692",
    "workflow_run_url": "https://github.com/AZMadeEZ/MS-Repo-Tracker/actions/runs/28744716692"
  },
  "top_links": [
    {
      "priority": 1,
      "repo": "microsoft/dbt-fabricspark",
      "url": "https://github.com/microsoft/dbt-fabricspark/releases/tag/v1.12.9",
      "why": "Release activity: v1.12.9"
    },
    {
      "priority": 2,
      "repo": "Azure/azure-sdk-for-net",
      "url": "https://github.com/Azure/azure-sdk-for-net/pull/59730",
      "why": "Feature or capability signal: Add Azure.AI.AgentServer.Optimization client library"
    },
    {
      "priority": 3,
      "repo": "MicrosoftDocs/Xandr-docs",
      "url": "https://github.com/MicrosoftDocs/Xandr-docs/commit/853015be05b18dc8f2ca75c374788bef1a096f49",
      "why": "Docs update: PR-bidders (#1480)"
    },
    {
      "priority": 4,
      "repo": "MicrosoftDocs/azure-aks-docs",
      "url": "https://github.com/MicrosoftDocs/azure-aks-docs/commit/70b8858c8149451fbede8b75176b12cb92842d30",
      "why": "Docs update: Merging changes synced from https://github.com/MicrosoftDocs/azure-ak\u2026"
    },
    {
      "priority": 5,
      "repo": "MicrosoftDocs/dataexplorer-docs",
      "url": "https://github.com/MicrosoftDocs/dataexplorer-docs/pull/2911",
      "why": "Docs update: Repo sync for protected branch"
    },
    {
      "priority": 6,
      "repo": "Azure-Samples/foundry-local-model-catalog",
      "url": "https://github.com/Azure-Samples/foundry-local-model-catalog/pull/9",
      "why": "Sample update: Update MODEL_CATALOG.md (build 170707830)"
    },
    {
      "priority": 7,
      "repo": "MicrosoftLearning/mslearn-ai-concepts",
      "url": "https://github.com/MicrosoftLearning/mslearn-ai-concepts/commit/378b5f848b4f604ae841157e592d22c36d6c386c",
      "why": "Training update: Update readme.md"
    },
    {
      "priority": 8,
      "repo": "MicrosoftLearning/mslearn-ai-fundamentals",
      "url": "https://github.com/MicrosoftLearning/mslearn-ai-fundamentals/commit/baa141f34ea140d245a8f6a41e166c8c353e0893",
      "why": "Training update: Update text lab"
    }
  ],
  "totals": {
    "candidate_repos": 40,
    "default_branch_commits": 65,
    "filtered_repos": 2952,
    "inventory_repos": 16567,
    "pushed_at_candidate_repos": 40,
    "release_count": 1,
    "repos_with_movement": 14,
    "repos_with_releases": 1
  },
  "window": {
    "hours_requested": 24,
    "since": "2026-07-04T12:47:20.313801Z",
    "state_window_enabled": true,
    "until": "2026-07-05T14:54:58.591531Z"
  }
}
